salary,job_info,enterprise_attr,job_url,enterprise_industry,job_num,enterprise_scale,job_enterprise,download_timeout,depth,job_attr,exp,edu,date,download_latency,job_place,job_name,download_slot
6001-8000元/月 ,"<p style=""white-space: normal;""><span style=""background-color: rgb(255, 255, 0);""><strong><span style=""color: rgb(255, 0, 0);"">云计算定岗委培实习生及工程师20名（岗前培训）</span></strong></span></p><p style=""white-space: normal;""><span style=""background-color: rgb(255, 255, 0);""><strong><span style=""color: rgb(255, 0, 0);""><br></span></strong></span></p><p style=""white-space: normal;""><strong>行业前景</strong>：2016年5月李克强总理承诺重推云计算与大数据应成国家战略，总理要求中国互联网IT企业家要以云计算、大数据理念，与企业信息技术平台有机对接，建立统一综合信用信息平台，实现“大数据”共享。</p><p style=""white-space: normal;"">2015年,可说是中国云计算发展、落地之年。中国一线的云计算巨头，如阿里云、腾讯云等，在2015年数据中心的服务器数量纷纷超过50万台;作为衡量云计算厂商的最基础的硬指标，在2016年，数据中心建设将进入高峰期，有云计算厂商的服务器数量将会突破100万台。</p><p style=""white-space: normal;""><br></p><p style=""white-space: normal;""><strong>就业单位：</strong>中国人民银行、中国金融认证中心、中国人民银行软件开发中心、中金支付、嘉实基金等各大金融机构！阿里巴巴、百度、亚马逊、谷歌、微软、华为、IBM、思科、中国电信、北京南天软件公司、宇信易诚科技有限公司、软通动力、各大银行下属机构、金融信息行业及部分高新产业上市公司等。</p><p style=""white-space: normal;""><br></p><p style=""white-space: normal;""><strong>工作内容：</strong></p><p style=""white-space: normal;"">1、 负责云计算平台整体架构设计，建设规划；</p><p style=""white-space: normal;"">2、 云计算相关技术跟进及云计算项目跟进；</p><p style=""white-space: normal;"">3、 负责云计算平台整体架构设计方案编写与技术交流；</p><p style=""white-space: normal;"">4、 云计算项目实施与运维，以及云计算项目客户培训； </p><p style=""white-space: normal;"">5、 熟悉主流操作系统，数据库配置与维护；</p><p style=""white-space: normal;"">6、 路由与交换原理，简单配置</p><p style=""white-space: normal;""><br></p><p style=""white-space: normal;""><strong>任职要求：</strong></p><p style=""white-space: normal;"">1. 大专以上学历，应/往届毕业生，有志于在IT行业发展。</p><p style=""white-space: normal;""><span style=""line-height: 1.5; text-align: center;"">2. 专业不符、计算机理论知识和IT项目经验不足的情况，公司会提供零基础岗前实训，享受企业补助计划，学习期间不用支付任何费用</span><strong style=""line-height: 1.5; text-align: center;"">（表现优异奖励3000-8000元）</strong></p><p style=""white-space: normal;""><br></p><p style=""white-space: normal;""><strong>薪资待遇： </strong><br>签订正式劳动合同、办理组织关系迁转、享受国家规定的保险福利待遇，大数据、云计算工程师平均起薪不低于9000元。</p><p style=""white-space: normal;""> </p><p style=""white-space: normal;"">联系人：张主任<br>电话：17326908690</p><p style=""white-space: normal;"">QQ:1061965274; 微信：17326908690</p><p class=""p"" style=""margin: 3.75pt 0pt; text-indent: 0pt; mso-pagination: widow-orphan; mso-line-height-alt: 12pt;""><span style=""letter-spacing: 0pt; font-size: 10.5pt;""></span><span style=""letter-spacing: 0pt; font-size: 10.5pt;""><p></p></span></p>",民营,http://jobs.zhaopin.com/642888722251469.htm,IT服务(系统/数据/维护),20人 ,100-499人,北京蓝色曙光信息技术有限公司,180.0,1,全职,不限,不限,2016-12-20,0.244035005569458,上海,银行云计算大数据工程师（实训后转正）,jobs.zhaopin.com
6001-8000元/月 ,"<p class=""MsoNormal"" style=""line-height: 18.75pt; background: rgb(255, 255, 255);""><span style=""line-height: normal;"">荣新中关村IT人才服务中心是由北京中关村软件园授权的人才输送中心，是为了解决中关村软件园园区内企业的用人需求而创办的人才中心。我中心是落实中关村软件园人才发展战略，中关村软件园官方联合设立的人力资源服务中心，承担着为园区内IT企业输送高端技术人员的重要使命！自06年至今，北京荣新中关村IT人才服务中心共输出IT技术工程师达2万余人，基地承担着全国300多家国际知名软件企业的人才培养、输送的任务，随着园区二期工程的即将完工，更多的中大型IT企业进入园区，我中心计划每年累计为园区企业输送IT人才近万名。招聘岗位：<strong>Java+Oracle+大数据实习工程师 </strong></span></p><div>任职要求： </div><div>1、理工科，有志于在IT行业发展；计算机（网络)、电子信息、软件工程、（电气）自动化、测控、生仪、机电等专业。 </div><div>2、有计算机语言基础者优先，如：C\C++、Java、.net等。 </div><div>3、在京工作一年后要求回当地工作的，可以调回当地省会城市的分公司或合作企业工作。 </div><div>4、入职前同意在人才服务中心集中参加岗前学习三到四个月。</div><div>待遇：     </div><div>享受人才服务中心高端人才补助计划，,且在实训期间还可以得到3000元的现金生活补助，实训之后可以凭借实训所获技找到相应工作，工作之后按月偿还实训产生的费用；签定正式劳动合同、享受国家规定的保险福利待遇，入职起薪平均薪酬在6000元左右，第二年起薪高于8000元/月。</div><div>地址：北京市海淀区中关村</div><div>国内免费咨询：400 818 1186 </div><div>QQ 2339380189 微信 2339380189</div><div>24小时咨询热线：15801386865钱老师</div><div>官方网址：<a href=""http://rongxinhr.com/""><strong>http://rongxinhr.com/</strong></a></div><div>服务平台邮箱：vfast_zpark@163.com  </div>",民营,http://jobs.zhaopin.com/238076930277852.htm,计算机软件,30人 ,500-999人,北京艺耘诺布投资管理有限公司,180.0,1,全职,不限,大专,2016-12-20,0.19437313079833984,上海,java/c/c++软件工程师 大数据开发 实习生 高薪急招,jobs.zhaopin.com
6001-8000元/月 ,"<p class=""MsoNormal"" style=""line-height: 18.75pt; background: rgb(255, 255, 255);""><span style=""line-height: normal;"">荣新中关村IT人才服务中心是由北京中关村软件园授权的人才输送中心，是为了解决中关村软件园园区内企业的用人需求而创办的人才中心。我中心是落实中关村软件园人才发展战略，中关村软件园官方联合设立的人力资源服务中心，承担着为园区内IT企业输送高端技术人员的重要使命！自06年至今，北京荣新中关村IT人才服务中心共输出IT技术工程师达2万余人，基地承担着全国300多家国际知名软件企业的人才培养、输送的任务，随着园区二期工程的即将完工，更多的中大型IT企业进入园区，我中心计划每年累计为园区企业输送IT人才近万名。招聘岗位：<strong>Java+Oracle+大数据实习工程师 </strong></span></p><div>任职要求： </div><div>1、理工科，有志于在IT行业发展；计算机（网络)、电子信息、软件工程、（电气）自动化、测控、生仪、机电等专业。 </div><div>2、有计算机语言基础者优先，如：C\C++、Java、.net等。 </div><div>3、在京工作一年后要求回当地工作的，可以调回当地省会城市的分公司或合作企业工作。 </div><div>4、入职前同意在人才服务中心集中参加岗前学习三到四个月。</div><div>待遇：     </div><div>享受人才服务中心高端人才补助计划，,且在实训期间还可以得到3000元的现金生活补助，实训之后可以凭借实训所获技找到相应工作，工作之后按月偿还实训产生的费用；签定正式劳动合同、享受国家规定的保险福利待遇，入职起薪平均薪酬在6000元左右，第二年起薪高于8000元/月。</div><div>地址：北京市海淀区中关村</div><div>国内免费咨询：400 818 1186 </div><div>QQ 2339380189 微信 2339380189</div><div>24小时咨询热线：15801386865钱老师</div><div>官方网址：<a href=""http://rongxinhr.com/""><strong>http://rongxinhr.com/</strong></a></div><div>服务平台邮箱：vfast_zpark@163.com  </div>",民营,http://jobs.zhaopin.com/238076930277857.htm,计算机软件,30人 ,500-999人,北京艺耘诺布投资管理有限公司,180.0,1,全职,不限,大专,2016-12-20,0.29763197898864746,上海,java/c/c++软件工程师 大数据开发 实习生 高薪急招,jobs.zhaopin.com
10001-15000元/月 ,<p>岗位职责：</p><p>1. 负责公司数据仓库项目的需求分析、方案设计和实施，以及相应的文档编写、数据核对工作</p><p>2. 开发并优化Map/Reduce框架来满足业务部门的离线分析需求</p><p>3. 搭建和维护Hadoop集群，熟悉Map/Reduce编程</p><p>4. Hadoop环境的维护、调优以及搭建</p><p>5. 大型分布式云计算平台应用开发</p><p>6. 设计并开发大数据服务同步和异步API</p><p>7. 开发并优化通用的实时在线事件关联、搜索和分析框架</p><p> </p><p>任职条件：</p><p>1. 大学本科及以上学历，计算机相关专业毕业，有扎实的计算机理论基础，对数据结构及算法有较强的功底</p><p>2. 具备三年以上相关开发工作经验</p><p>3. 熟悉算法设计/数据结构，精通Java或Python语言编程， 熟悉Linux/Unix平台上的开发环境，对新技术充满热情，愿意投身大数据事业</p><p>4. 熟悉主流的云计算、大数据产品和数据分析技术（机器学习)并具有相关项目经验，熟悉Hadoop、Hive、Hbase、Map/Reduce优先</p><p>5. 良好的沟通表达（口头及书面）和文档交付能力</p><p>6. 勤奋踏实、工作积极主动、有责任心，能够在压力下工作，思路敏捷清晰，良好的表达、理解和学习能力，强烈的创新意识</p><p>7. 具有很强的分析问题和解决问题的能力，攻关疑难问题的强烈兴趣，善于学习，具有很强的团队管理能力和沟通能力</p>,外商独资,http://jobs.zhaopin.com/000457559255181.htm,医药/生物工程,1人 ,10000人以上,上海药明康德新药开发有限公司,180.0,1,全职,3-5年,本科,2016-11-08,0.22264385223388672,上海,Hadoop Engineer大数据开发工程师,jobs.zhaopin.com
面议 ,<p>岗位职责：</p><p>1、负责大数据平台的设计、开发、单元测试工作；</p><p>2、能够按照进度要求完成相关的开发任务，</p><p>3、配合测试人员的测试工作，及时修复测试过程发现的BUG，并不断对系统进行优化；</p><p><br></p><p>任职要求：</p><p>1、大学本科毕业，3年或3年以上工作经验；</p><p>2、精通Java或C/C++，熟练使用scala；</p><p>3、精通CDH、spark、storm；</p><p>4、熟悉MySQL、Redis、HBase、ES系统；</p><p>5、熟悉分布式软件开发过程、软件设计模式、常用的的开发框架；</p><p>6、具有良好的沟通能力，良好的团队合作精神，对工作积极主动，能有条理的完成工作任务。</p><p>7、有基于hadoop、spark、storm进行数据产品开发经验者优先</p><p><br></p>,上市公司,http://jobs.zhaopin.com/508620126255270.htm,计算机软件,5人 ,10000人以上,中软国际科技服务有限公司深圳分公司,180.0,1,全职,1-3年,大专,2016-11-21,0.14232492446899414,上海,大数据开发,jobs.zhaopin.com
10001-15000元/月 ,"<p>岗位职责：<br>1、用户海量日志统计分析<br>2、 利用storm、spark等框架做数据的实时及离线分析<br>3、大数据产品的WEB接口设计，算法设计<br>4、负责公司产品研发过程中的集群的维护<br><br>岗位要求：<br>1、熟练精通数据结构与算法，熟悉分布式开发框架 (Hadoop Spark,Storm,Kafka等 至少精通一种)；<br>2、熟悉NOSQL 数据库,redis，MongoDB；<br>3、熟练mysql数据库；<br>4、熟悉Linux 操作系统 可以自行部署开发环境；<br>5、精通java python。<br><br></p>",民营,http://jobs.zhaopin.com/340387113250337.htm,互联网/电子商务,1人 ,100-499人,上海石易电子科技有限公司,180.0,1,全职,1-3年,本科,2016-11-21,0.373150110244751,上海,大数据工程师,jobs.zhaopin.com
7000-14000元/月 ,<p>岗位职责：</p><p>1、负责云计算平台整体架构设计，建设规划；<br>2、云计算相关技术跟进及云计算项目跟进；<br>3、负责云计算平台整体架构设计方案编写与技术交流；<br>4、云计算项目实施与运维，以及云计算项目客户培训； <br>5、熟悉主流操作系统，数据库配置与维护；<br>6、参与平台底层组件（如mysql 分析、网络分析，负载均衡等）开发；<br>7、路由与交换原理，简单配置。</p><p><br></p><p>任职要求：</p><p>1、计算机、数学相关专业；<br>2、有3年以上开发经验，熟悉java、python、php等常用开发语言，参与过服务端方面的开发；<br>3、热爱软件编程，对新技术有强烈的爱好；<br>4、熟悉go、golang、scala、akka等技术优先考虑。</p><p><br></p><p>工作地点：上海<br></p>,民营,http://jobs.zhaopin.com/445491482250056.htm,互联网/电子商务,1人 ,20-99人,济南数盺医疗信息技术有限公司,180.0,1,全职,3-5年,本科,2016-11-21,0.20670008659362793,上海,大数据云计算工程师,jobs.zhaopin.com
7000-14000元/月 ,"<p>岗位职责：</p><p>1、大数据环境下的开发，数据分析；<br>2、大数据平台Map/Reduce任务开发；<br>3、大数据平台数据清洗、转换、建模的开发工作,处理离线数据；<br>4、保证大数据平台数据与各源系统数据准确性；<br>5、Storm平台开发结合业务的应用，处理实时数据，实时应用场景的开发；<br>6、大数据平台的运维工作，持续完善大数据平台，保证稳定性、安全性。</p><p><br></p><p>任职要求：</p><p>1、对HADOOP大数据平台架构了解熟悉，有Map/Reduce开发运维经验，熟悉HIVE；<br>2、具有STORM实时平台、NOSQL、HBASE等大数据项目经验者优先；<br>3、精通JAVA语言开发，懂Python或者C++优先；<br>4、掌握或了解非结构化数据的保存、分析、访问、调优，掌握或使用过至少一种Nosql的开源产品，并真正用于项目中,如mongodb, redis, cassandra等；<br>5、在云计算和云存储方面有丰富经验；<br>6、如果有以下经验者更佳：<br>- 有REST/SOA架构/大型分布式系统开发经验<br>- 精通Linux开发平台及工具链，熟悉Linux系统的配置管理<br>- 熟悉Hadoop，HBase， Hive等开源大数据相关技术<br>- 熟悉Python，Shell等。</p><p><br></p><p>工作地点：上海<br></p>",民营,http://jobs.zhaopin.com/445491482250057.htm,互联网/电子商务,1人 ,20-99人,济南数盺医疗信息技术有限公司,180.0,1,全职,3-5年,本科,2016-11-21,0.19200611114501953,上海,Java大数据开发工程师,jobs.zhaopin.com
7000-14000元/月 ,"<p>岗位职责：</p><p>1. 负责和参与公司大数据基础架构平台的运维，保障数据平台服务的稳定性和可用性；<br>2. 负责和参与超大规模数据存储与计算任务的精细化管理系统的设计，选型和开发；<br>3. 负责和参与大数据基础架构平台的监控、资源管理、数据流管理；<br>4. 负责和参与自动化运维系统及平台的建设；<br>5. 负责和参与基于数据分析的可预测的云平台弹性扩展解决方案</p><p><br></p><p>任职要求：</p><p>1. 三年以上计算机软件开发工作经验 ；<br>2. 掌握Linux操作系统的配置，管理及优化，能够独立排查及解决操作系统层的各类问题；<br>3. 掌握虚拟机技术KVM；OpenStack开源系统， docker应用容器引擎;<br>4. 掌握Hadoop, Kafka, Zookeeper, Hbase, Spark的安装与调试；<br>5. 至少精通Python, Perl, Ruby, Bash脚本语言中的一种；<br>6. 有良好的系统性能优化及故障排除能力；<br>7. 熟悉大数据周边相关的数据库系统，关系型数据库和NoSQL。</p><p><br>工作地点：上海</p><p><br></p>",民营,http://jobs.zhaopin.com/445491482250058.htm,互联网/电子商务,1人 ,20-99人,济南数盺医疗信息技术有限公司,180.0,1,全职,3-5年,本科,2016-11-21,0.2835400104522705,上海,大数据运维工程师,jobs.zhaopin.com
7000-14000元/月 ,<p>岗位职责：</p><p>1、负责前端大数据可视化方面的研究及开发工作；<br>2、根据给定的业务数据，完成数据的可视化展示，实现较为丰富的数据交互功能；<br>3、负责数据展示类的界面设计、图标设计和创意工作，并参与交互设计和用户体验设计；<br>4、参与产品前期界面视觉用户研究、设计流行趋势分析；<br>5、研究用户需求，进行概念设计，并最终定义产品信息架构、交互及视觉细节；<br>6、独立完成界面相关图形设计工作，能根据数据展现的思路设计对应配套的界面；<br>7、要能够做数据展示类产品的设计。</p><p><br></p><p>任职要求：</p><p>1、计算机相关专业大学本科及以上学历；<br>2、熟悉Processing、D3、W3C、HTML5、JavaScript、CAD、PHP、Highcharts等前端开发语言，熟练掌握页面架构布局和兼容性调试；<br>3、了解计算机图形学；<br>4、良好的沟通能力及团队合作意识，对工作有高度的工作热情和责任感；<br>5、对数据有比较强的理解能力；<br>6、了解D3.js、zrender、Three.js等前端可视化框架者优先考虑；<br>7、有数据可视化相关的学习经历或工作经验者优先。</p><p><br></p><p>工作地点：上海<br></p>,民营,http://jobs.zhaopin.com/445491482250060.htm,互联网/电子商务,1人 ,20-99人,济南数盺医疗信息技术有限公司,180.0,1,全职,不限,本科,2016-11-21,0.20046496391296387,上海,大数据可视化工程师,jobs.zhaopin.com
7000-14000元/月 ,"<p>岗位职责：</p><p>1. 负责公司的大数据处理框架的研发工作，设计与开发基于Hadoop平台的海量日志的分布式存储与数据分析架构。<br>2. 负责Hadoop集群配置管理，性能调优；Hadoop集群日常维护，提供稳定的系统服务。<br>3. 负责MapReduce程序编写，Hbase数据库等开发工作。<br>4. 负责数据采集及预处理程序开发、维护，优化。<br>5. 负责项目相关设计、开发、测试文档的撰写。</p><p><br></p><p>任职要求：</p><p>1. 精通大数据分析处理（Hadoop，HDFS, MapReduce，Hbase，Pig，Hive）等技术内部机制；有Hadoop集群搭建，管理，优化经验。<br>2. 扎实的Java语言基础，熟悉Java开发工具和调试工具的使用。<br>3. 熟悉Linux系统，熟练使用shell/perl/python脚本处理问题。<br>4. 本科及以上学历。<br>5. 2年以上相关工作经验。<br>6. 有独立解决技术问题的能力，文档编写能力，沟通和协作能力等。<br>7. 具有较强的团队意识与良好的沟通能力，高度的责任感，对工作积极严谨，勇于承担压力，较强的学习能力以及快速解决问题的能力。<br>8. 有海量数据挖掘算法开发经验者优先；兼有Oracle，MySQL开发经验者优先。</p><p><br></p><p>工作地点：上海<br></p>",民营,http://jobs.zhaopin.com/445491482250063.htm,互联网/电子商务,1人 ,20-99人,济南数盺医疗信息技术有限公司,180.0,1,全职,3-5年,本科,2016-11-21,0.21243906021118164,上海,大数据软件工程师,jobs.zhaopin.com
4001-6000元/月 ,<p>岗位职责：</p><p>1.               按照既定的分析模型，对数据进行分析，定期提交分析报告；</p><p>2.               在指定的渠道发布审核后的分析报告；</p><p>3.               收集原始数据，并对原始数据按照分析的要求进行清洗，达到可分析标准；</p><p>4.               参与分析模型的讨论，提出建立和完善分析模型的独立意见。</p><p>任职要求：<br></p><p>1.               大学本科以上数学与统计分析，经济和金融相关专业或者知识背景。</p><p>2.               具有数据统计与分析方面的工作经历者优先</p><p>3.               掌握常用的数据分析和商业智能分析（BI）工具，了解大数据分析工具者优先</p><p>关键指标：</p><p>1.               报告发布的及时性、准确性</p><p><br></p>,民营,http://jobs.zhaopin.com/454930880250000.htm,互联网/电子商务,1人 ,20人以下,上海哈捷科技有限公司,180.0,1,全职,1年以下,本科,2016-11-21,0.31470799446105957,上海,大数据分析员,jobs.zhaopin.com
7000-12000元/月 ,<p>岗位职责:<br></p><p>岗位职责：<br>1、Linux系统管理、优化、安装、大数据平台管理。<br>2、熟练编写Linux Shell脚本，完善服务器集群自动化监控、管理、自动恢复、报警等。<br>3、系统维护、权限管理、网络管理、Trouble Shooting。<br>4、熟练Nginx、Mysql、Tomcat、Apache等部署及热备应用实现、性能调优；<br>5、优秀的编程习惯及规范性、全局观；<br>6、海量数据采集及加工处理能力。<br>7、忠诚度高、保密意思、积极进取、谦虚细心、优秀的学习能力。</p>,民营,http://jobs.zhaopin.com/000094123252301.htm,通信/电信运营、增值服务,1人 ,100-499人,和讯网,180.0,1,全职,1-3年,大专,2016-11-22,0.29455089569091797,上海,【大数据部】Linux运维工程师(职位编号：hexun000758),jobs.zhaopin.com
10001-15000元/月 ,<p>岗位职责：</p><p>1)	计算机软件等相关专业，有相关工作经验者优先；</p><p>2)	熟练掌握c、c++、java语言，具备独立编程实现复杂项目的能力；</p><p>3)	熟练掌握oracle等常用关系型数据库系统；</p><p>4)	有Hadoop分布式平台工作经验，熟练掌握Hive、Hbase、Pig、Hdfs、Map/Reduce、Storm中两种以上开发技术；</p><p>5)	熟悉分布异构系统通信机制与基础方法；</p><p><br></p><p>附加：薪酬高，绩效不封顶！</p>,民营,http://jobs.zhaopin.com/424887632250001.htm,计算机软件,5人 ,20-99人,上海客鹭信息技术有限公司,180.0,1,全职,1-3年,不限,2016-11-24,0.22581982612609863,上海,大数据研发工程师,jobs.zhaopin.com
8001-10000元/月 ,<p>岗位要求： <br>1 Computer Science or Engineering degree Bachelor Degree or higher ,外商独资,http://jobs.zhaopin.com/276864437250389.htm,计算机硬件,1人 ,100-499人,丽台(上海)信息科技有限公司,180.0,1,全职,3-5年,本科,2016-11-24,0.2884509563446045,上海,大数据售前,jobs.zhaopin.com
12000-20000元/月 ,"<p>岗位职责： </p><p>1.负责算法模型的设计和开发工作。 </p><p>2.负责大数据开发平台的维护和优化工作。 </p><p>3.负责数据ETL相关开发工作。 </p><p>4.负责数据结果的展现及报表开发工作。 </p><p> </p><p>任职资格： </p><p>1、全日制本科及以上学历，计算机或数据相关专业； </p><p>2、2～5年的大数据相关开发组织工作经验； </p><p>3、具备大数据处理Hadoop/MapReduce及Hive、Spark、Hbase等项目经验； </p><p>4、具备Mahout或其他数据建模的相关工作经验； </p><p>5、具备独立建模和数据分析能力,有良好的业务沟通能力; </p><p>6、具备基于Hadoop平台的建模算法实现和优化的工作经验; </p><p>7、具备金融行业、电子商务相关行业项目经验者优先。</p><p><br></p>",民营,http://jobs.zhaopin.com/279480181250021.htm,计算机软件,1人 ,20-99人,上海评驾网络科技有限公司,180.0,1,全职,不限,不限,2016-11-25,0.1637120246887207,上海,大数据处理工程师,jobs.zhaopin.com
1000-2000元/月 ,<p>1.通过海量数据挖掘、机器学习等方法进行核心策略的研究及开发； ,民营,http://jobs.zhaopin.com/274879282250076.htm,基金/证券/期货/投资,10人 ,100-499人,上海朗月股权投资管理中心(有限合伙),180.0,1,全职,3-5年,本科,2016-11-25,0.08179211616516113,上海,Java工程师（大数据 数据挖掘）,jobs.zhaopin.com
