salary,job_info,enterprise_attr,job_url,enterprise_industry,job_num,enterprise_scale,job_enterprise,download_timeout,depth,job_attr,exp,edu,date,download_latency,job_place,job_name,download_slot
20000-40000元/月 ,<p>岗位职责</p><p>1、负责眸事数据平台类产品以及数据服务类产品的规划和设计 </p><p>2、研究眸事大数据平台化和开放的形态和生态，推动多个业务领域内的数据平台产品的创新和设计 </p><p>3、关注大数据应用相关方向的前沿研究<br>4、有比较丰富的产品经验，从需求的确认、产品的原型，PRD的撰写、资源的协调，产品上线后的跟进与项目管理；有上线产品的成功和失败的案例 <br>5、具有数据挖掘分析功底，敏锐的数据洞察力 <br>6、与各相关部门紧密合作，推进产品的实施和对外合作 </p><p><br>任职资格： <br>1、3年以上工作经验，工科背景优先 </p><p>2、计算数学、数理统计和计算机相关专业背景者优先 <br>3、自我驱动力强，面对复杂情况能够独立工作；跨团队与部门的沟通能力强，有较强的团队协作意识和能力 <br>4、热爱数据，喜欢钻研新产品新业务 <br>5、有开放平台、数据产品设计经验者优先考虑 <br>6、富有激情和强烈的创新意识</p>,外商独资,http://jobs.zhaopin.com/397217913250095.htm,专业服务/咨询(财会/法律/人力资源等),1人 ,100-499人,麦曼(上海)企业管理咨询有限公司,180.0,1,全职,3-5年,本科,2016-12-19,0.3319389820098877,上海,高级产品经理（大数据服务产品设计方向）,jobs.zhaopin.com
30001-50000元/月 ,<p>职位描述</p><p>1.优化调整大数据平台的整体架构；</p><p>2.大数据平台基础架构设计；</p><p>3.负责大数据平台数据中心的基础设施的建设落地；</p><p>4. 研究新的技术并运用于大数据平台，提高平台的运行效率。</p><p><br></p><p>任职条件</p><p>1. 3年以上互联网行业大数据平台经验；</p><p>2.熟悉Hadoop/Spark/Storm，有管理或优化大型分布式集群经验；</p><p>3.熟悉openstack，docker，mesos，kubernetes等云计算技术；</p><p>4.有分布式系统分析及架构设计经验，有大型计算集群的基础设施开发维护经验；</p><p>5.熟悉hive，kylin，kudu，presto，有数据仓库建设经验优先；</p><p>6.沟通能力强，有团队合作意识。</p>,外商独资,http://jobs.zhaopin.com/201268312254049.htm,专业服务/咨询(财会/法律/人力资源等),1人 ,500-999人,上海嘉驰商务咨询有限公司,180.0,1,全职,不限,不限,2016-12-19,0.23038411140441895,上海,大数据架构师,jobs.zhaopin.com
10001-15000元/月 ,<p>【工作职责】<br>1、负责企业内部和外部相关业务需求的调研，负责基础数据分类整理及相关数据管理系统的设计；<br>2、基于用户体验设计理念，结合用户需求和产品技术架构，完成产品/功能的概念设计和原型展示；<br>3、在软件开发前，完成交付给开发和测试团队产品需求文档，功能定义，协同用户体验设计师完成视觉设计，交互设计等详细设计文档；<br>4、协调技术开发人员，跟踪产品开发进度，完成产品的开发、测试、版本管理，评审发布，产品上线等相关工作；<br>5、协同研发团队监督确保产品开发的合理架构、优化方案、资源落实和项目进度；<br>6、跟踪上线产品的市场效果、用户反馈，收集和主动挖掘改进需求，根据业务需要持续改进产品。<br><br><br>【任职资格】<br>1、	电子商务、信息管理、计算机、数学、传媒专业或相关专业本科以上学历<br>2、	对数据敏感，有一定的数据分析能力，有搜索、统计等数据类产品或数据可视化的工作经验优先；<br>3、	参与过不少于一款产品的设计和研发，有过2-4年互联网或者移动互联网产品设计策划经验<br>4、	能够撰写需求文档和产品的原型，具有产品需求分析和规划能力<br>5、	卓越的逻辑思维与分析能力，能够很好的规划和设计产品功能、使用流程与交互体验；<br>6、	有比较强的沟通协调能力，有很好的抗压能力，<br>7、	有数据产品、安全相关产品经验者优先。<br></p>,国企,http://jobs.zhaopin.com/357866628250092.htm,互联网/电子商务,1人 ,500-999人,天翼视讯传媒有限公司,180.0,1,全职,1-3年,本科,2016-12-19,0.06413912773132324,上海,大数据产品经理,jobs.zhaopin.com
6000-12000元/月 ,<p>岗位职责：</p><p>1、制定并实施数据产品销售计划，完成销售任务</p><p>2、建立、维护客户关系，及时建立健全客户档案</p><p>3、协助研发、产品经理和售前等团队处理客户方资源协调等事宜</p><p>4、独立或配合实施本销售区域的产品宣传、公关促销、推广策划工作</p><p>5、完成区域目标客户和目标渠道的营销推广</p><p><br></p><p>岗位要求：</p><p>1、能够独立进行销售工作及销售管理工作</p><p>2、有较强的销售理论知识、谈判技巧、人际交往能力和沟通能力、应变能力和学习能力；</p><p>3、能经常出差</p><p>4、三年以上销售经验</p><p>5、有高校IT或者培训相关销售经验，熟悉高校组织架构和教育厅的业务特点者优先</p><p>6、与企业HR有人际关系有限</p><p><br></p>,民营,http://jobs.zhaopin.com/482493526250075.htm,计算机软件,5人 ,20-99人,上海智隆信息技术股份有限公司,180.0,1,全职,3-5年,大专,2016-12-19,0.3227500915527344,上海,大数据产品销售经理,jobs.zhaopin.com
10000-20000元/月 ,<p>岗位职责：</p><p>1.负责大数据平台的开发、维护工作；</p><p>岗位要求：</p><p>1.本科及以上学历，计算机相关专业；</p><p>2.有1－3年大数据或数据仓库项目经验，了解数据仓库相关理论知识；</p><p>3.熟练掌握Hadoop及Map-Reduce应用开发，精通HBase、Hive、Pig、Storm等大数据开发工具者优先；</p><p>4.精通SQL开发，精通Mysql、Oracle等关系型数据库中的一种；</p><p>5.精通java开发；</p><p>6.熟悉Linux系统，具备shell、perl等脚本开发能力；</p><p>7.学习能力强，喜欢研究新技术，有团队观念，具备独立解决问题的能力；</p><p><br></p>,民营,http://jobs.zhaopin.com/482493526250072.htm,计算机软件,2人 ,20-99人,上海智隆信息技术股份有限公司,180.0,1,全职,1-3年,本科,2016-12-19,0.11658501625061035,上海,大数据开发工程师,jobs.zhaopin.com
20001-30000元/月 ,"<p>岗位职责:</p><p>    * 基于互联网大数据，开发欺诈预测模型和信用评分模型；</p><p>    * 负责与外部机构合作数据实验室，开展共同建模工作；</p><p>    * 协助数据工程团队改进数据获取及清洗工作；</p><p>    * 负责为合作机构应用本公司数据及模型提供支持。</p><p><br></p><p>岗位要求：</p><p>    全日制本科及以上学历，计算机、数学、金融、统计等相关专业；</p><p>    2年以上数据建模工作经验，可独立完成模型需求调研、模型构建；</p><p>    至少熟练使用SAS/R/Python中的一种编写数据建模代码, 能熟练使用SQL；</p><p>    有金融行业/银行数据分析、建模经验者优先；</p><p>    具备良好沟通能力，学习能力，和团队协作精神。</p><p><br></p>",民营,http://jobs.zhaopin.com/261534987250012.htm,IT服务(系统/数据/维护),2人 ,20-99人,上海凭安征信服务有限公司,180.0,1,全职,1-3年,本科,2016-12-19,0.2087719440460205,上海,大数据建模工程师,jobs.zhaopin.com
20000-40000元/月 ,<p>岗位职责：</p><p>1、 负责公司XX大数据项目的需求分析，整体解决方案的设计、Demo演示及非标等技术支持工作；</p><p>2、 组建并管理XX大数据项目开发组；</p><p>3、 主要负责企业级XX大数据平台开发框架的设计、性能调优、数据流监控及日常维护；</p><p>4、 直接参与或指导开发人员基于框架进行海量数据的处理、分析、挖掘；</p><p>5、 负责开源大数据平台与产品和相关技术的追踪及研究；</p><p>6、 负责高并发、大存储、实时计算等技术攻关；</p><p>7、 负责大数据平台及产品研发团队的组织与管理，并进行相关技术培训；</p><p><br></p><p>任职资格：</p><p>1、大学本科学历以或上，计算数学、数理统计和计算机相关专业背景，5年以上团队管理工作经验，3年以上产品规划经验，熟悉产品管理的专业知识；</p><p>2、具有Hadoop，HDFS，Hive等大数据技术的项目设计和实施经验，熟悉MES或ERP等相关管理软件应用及实施情况。</p><p>3、对主流大数据产品、BI产品的现状和发展趋势有深入了解 ；</p><p>4 负责设计过数据分析、数据挖掘、数据可视化、在线数据相关产品经验 ；</p><p>5、了解数据挖掘技术，需要有深入的商业智能或者数据挖掘工作经验，熟悉常见数据挖掘模型算法，精通至少1种数据分析工具；</p><p>6、追求高品质产品的精神与热情，对行业动态有足够洞察力及敏锐度；</p><p>7、具有优秀的表达、沟通与协调能力、团队合作精神、保密意识；</p><p><br></p>,民营,http://jobs.zhaopin.com/482493526250076.htm,计算机软件,1人 ,20-99人,上海智隆信息技术股份有限公司,180.0,1,全职,3-5年,本科,2016-12-19,2.3428690433502197,上海,大数据开发总监,jobs.zhaopin.com
50000元/月以上 ,<p>岗位职责：1、负责提升大数据各系统的整体架构设计质量，对大数据系统各组件的高可用和高性能负责。 2、负责大数据各系统架构设计的review和架构改进实践。 3、负责提升从数据采集到数据处理和线上应用的整个数据价值链条上的各环节的系统稳定性和可扩展性。 4、负责推广好的工程实践来提升各系统开发质量</p><p><br></p><p>任职要求：1、有大型分布式系统设计经验，负责过承载高流量压力的数据驱动型系统研发。 2、对大数据领域相关技术有丰富的经验，包括但不限于Hadoop／spark／storm／kafka／redis等等。 3、有丰富的架构设计经验，有技术洞察力，对业界技术发展方向有自己的判断和见解。 4、有工作激情，良好的沟通能力，有优秀的团队合作精神。</p>,民营,http://jobs.zhaopin.com/685148628250388.htm,专业服务/咨询(财会/法律/人力资源等),1人 ,20-99人,上海圣正企业管理咨询有限公司,180.0,1,全职,5-10年,硕士,2016-12-19,0.16914582252502441,上海,大数据系统中心高级架构师,jobs.zhaopin.com
20001-30000元/月 ,<p>岗位职责：</p><p>1.负责大数据平台产品的需求分析、目标规划、任务分解和平台运营；</p><p>2.敏捷式开发团队的建设与管理；</p><p>3.平台运营支持，收集客户反馈意见，迭代改进产品。</p><p>任职要求：</p><p>1.计算机相关专业本科以上学历；</p><p>2.5年以上产品经验，以及2年以上团队管理经验，至少独立负责过一款成功的产品；</p><p>3.熟悉主流的大数据产品和数据分析技术并具有相关项目经验，特别是BI应用、搜索平台、数据分析与挖掘平台；</p><p>4.良好的沟通与表达能力，思路清晰，有强烈的责任心和创新意识，业务逻辑理解与分析能力强。</p><p>5.独立思考的能力，团队合作的精神，积极学习的态度。</p><p><br></p>,民营,http://jobs.zhaopin.com/577765025250773.htm,互联网/电子商务,2人 ,100-499人,飞天联合(北京)系统技术有限公司,180.0,1,全职,5-10年,本科,2016-12-19,0.5599398612976074,上海,大数据高级产品经理,jobs.zhaopin.com
10001-15000元/月 ,<p>岗位职责：</p><p>1.负责大数据平台的产品开发；</p><p>2.完成各个模块单元的代码开发与测试；</p><p>3.平台运营支持，收集客户反馈意见，迭代改进产品；</p><p>4.持续关注新的技术，从其中选择适合我们的技术并应用其改进我们的产品。</p><p>任职要求：</p><p>1.计算机相关专业本科以上学历；</p><p>2.2年以上的大数据产品开发与运营经验，熟悉主流的大数据产品和数据分析技术并具有相关项目经验，特别是对Hadoop、Hbase等有深入的研究；</p><p>3.熟悉数据仓库相关技术，丰富的数据挖掘、机器学习相关开发经验；</p><p>4.良好的沟通与表达能力，思路清晰，有强烈的责任心和创新意识，业务逻辑理解与分析能力强。</p><p>5.独立思考的能力，团队合作的精神，积极学习的态度。</p><p><br></p>,民营,http://jobs.zhaopin.com/577765025250775.htm,互联网/电子商务,9人 ,100-499人,飞天联合(北京)系统技术有限公司,180.0,1,全职,1-3年,本科,2016-12-19,0.4110739231109619,上海,大数据开发工程师,jobs.zhaopin.com
20001-30000元/月 ,<p>岗位职责：</p><p>1.负责大数据平台的架构设计，定义可扩展的、分布式的大数据计算架构；</p><p>2.完成各种面向业务目标的数据分析模型的定义和应用开发；</p><p>3.持续关注新的技术，从其中选择适合我们的技术并应用其改进我们的产品。</p><p>任职要求：</p><p>1.计算机相关专业本科以上学历；</p><p>2.5年以上的大数据产品开发与运营经验，熟悉主流的大数据产品和数据分析技术并具有相关项目经验，特别是对Hadoop、Hbase等有深入的研究；</p><p>3.熟悉数据仓库相关技术，丰富的数据挖掘、机器学习相关开发经验；</p><p>4.良好的沟通与表达能力，思路清晰，有强烈的责任心和创新意识，业务逻辑理解与分析能力强。</p><p>5.独立思考的能力，团队合作的精神，积极学习的态度。</p><p><br></p>,民营,http://jobs.zhaopin.com/577765025250774.htm,互联网/电子商务,1人 ,100-499人,飞天联合(北京)系统技术有限公司,180.0,1,全职,5-10年,本科,2016-12-19,0.29324793815612793,上海,大数据系统架构师,jobs.zhaopin.com
10001-15000元/月 ,"<p>岗位职责：<br>1、执行公司销售战略，带领团队，开发企业客户,完成销售目标；<br>2、建立与维护良好的客户合作关系；<br>3、销售团队管理与培训，指导成员开展日常销售，参与重要项目的销售全过程，维护重点客户；<br>4、采集与分析市场信息，及时反馈市场动向，参与制定市场开发计划。<br><br>任职资格：<br>1、统招本科以上学历，理工科相关专业为佳；<br>2、5年以上销售经验，2年以上互联网营销 / 服务 / 软件 销售经验，能独立开发客户；<br>3、2年以上团队管理经验；<br>4、良好的销售能力、职业操守与团队合作精神。<br><br>公司业务情况很好、公司给资源！</p>",外商独资,http://jobs.zhaopin.com/131097966250431.htm,互联网/电子商务,1人 ,20-99人,商助科技（北京）有限公司,180.0,1,全职,不限,本科,2016-12-19,0.29313087463378906,上海,高级销售经理（大数据/企业级云服务）,jobs.zhaopin.com
15000-22000元/月 ,<p>岗位职责：<br>1.负责大数据相关的开发工作。<br>2.完成上级交办的其他任务。</p><p>岗位要求：<br>1.统招本科及以上学历，计算机相关专业；<br>2.3-5年开发经验，精通Java语言；<br>2.熟悉Unix/Linux操作系统，熟悉shell脚本；<br>3.熟悉MySQL、SQL Server、Oracle等数据库技术；<br>4.学习能力强，能通过项目快速掌握Hadoop开发；<br>5.良好的沟通能力和团队合作精神。</p><p> </p>,民营,http://jobs.zhaopin.com/148106168251586.htm,IT服务(系统/数据/维护),2人 ,100-499人,北京中亦安图科技股份有限公司,180.0,1,全职,不限,本科,2016-12-19,0.32888197898864746,上海,JAVA开发工程师（大数据方向）,jobs.zhaopin.com
15000-25000元/月 ,<p>岗位职责：</p><p>1、收集并处理大数据平台的质量问题，并进行及时反馈与沟通；</p><p>2、设计自动化框架监控每日数据仓库和数据产品的质量情况</p><p>3、针对hadoop平台的大数据项目设计测试方案，跟踪项目完成测试</p><p>4、维护测试组的知识体系文档，安排日常的组内培训和分享，完善整个测试组的知识体系；</p><p>5、收集过程改进建议，不断优化研发流程和各类规范，并做好过程改善的落地推广工作；</p><p>6、项目管理平台Jira和知识管理平台Confluence的维护和管理。</p><p><br></p><p>岗位要求：</p><p>1、本科及以上学历，软件工程等相关专业优先；5年以上工作经验，2年以上数据相关测试经验。</p><p>2、有较好的沟通能力及文档编写能力；熟悉质量管理体系，热衷于质量管理工作；</p><p>3、熟悉数据仓库体系，有hadoop平台测试经验的优先考虑</p><p>4、工作严谨、细致、有耐心；强烈的客户意识</p><p>5、能带领初级员工完成测试和质量跟踪管理工作</p>,股份制企业,http://jobs.zhaopin.com/537058027251026.htm,IT服务(系统/数据/维护),1人 ,20-99人,艾睦奇企业管理咨询(上海)有限公司,180.0,1,全职,不限,不限,2016-12-19,0.3052520751953125,上海,大数据平台测试经理,jobs.zhaopin.com
20000-25000元/月 ,"<p><span style=""line-height: 1.5;"">岗位职责： </span></p><p>1. 服务于银行、保险、消费金融等金融客户，提供基于大数据的营销咨询及解决方案服务</p><p>2. 根据客户的实际运营，挖掘客户可能存在的问题，并找出解决方案； <br>3. 配合销售团队，提供专业的咨询服务的同时，根据行业特征、规律，协助销售提供售前咨询； <br>4. 根据内部客户或外部客户的需求，整合公司内部产品，形成解决方案。 <br><br>岗位要求： <br>1. 大学本科及以上学历；</p><p>2. 2年及以上咨询行业经验，并且从事金融行业CRM/大数据/精准营销领域咨询；或具备2年及以上在金融行业从事市场营销、数据分析等相关工作经验； <br>4. 具备良好的沟通、演讲能力，具备优秀的方案编纂、撰写能力，能承受一定的工作压力；</p><p>5. 有数据分析或挖掘经验者优先</p><p>6. 精通Excel、PowerPoint等办公工具。</p>",股份制企业,http://jobs.zhaopin.com/681448026250396.htm,IT服务(系统/数据/维护),1人 ,100-499人,百融(北京)金融信息服务股份有限公司,180.0,1,全职,不限,本科,2016-12-19,0.27361607551574707,上海,大数据营销解决方案经理,jobs.zhaopin.com
20001-30000元/月 ,"<p>中国最大的第三方健康管理中外合资服务机构</p><p>招募大数据架构师，向技术总监直接汇报。</p><p><br></p><p><strong>Job description<span style=""line-height: 1.5;""> </span></strong></p><p>1、负责业务数据分析和数据模型设计，设计实现关系型数据库、数据仓库、实时数据库；</p><p>2、规划和完善数据平台，数据平台子系统（报表、Adhoc Query、OLAP、数据可视化等）<span style=""line-height: 1.5;"">的功能设计；</span></p><p>3、满足各业务决策层和业务分析人员在应用数据过程中的功能诉求并进行产品化,包括需求的收集、沟通、规划、项目推进、效果验收、线上故障跟进、用户反馈与产品运营等全过程；</p><p>4、根据数据的变化及时发现新的机会。</p><p> </p><p> </p><p><strong>Job requirement:</strong></p><p>1、本科及以上学历，计算机及相关专业，类似项目 5 年以上经验，并且负责项目架构设计；</p><p>2、熟悉主流的大数据产品和数据分析技术并具有相关项目经验；</p><p>3、有海量数据处理经验，处理的数据规模在 TB 级别以上；</p><p>4、熟悉主流的开源大数据产品，精通Hadoop/Storm/Spark/Neo4j/GraphX/Hive/HBase/Pig 等架构搭建；</p><p>5、熟悉 Linux/Unix 平台上的开发环境；</p><p>6、熟悉 C/C++、python、Java、R 语言、SAS，SPSS，matlab 等编程语言与工具（一项或多项）。</p><p>7、精通数据挖掘相关理论精通互联网架构。</p><p>8、熟悉 MogoDB、MySQL、NoSQL 等数据库/数据仓库开发者加分。</p><p>9、有 BI 系统搭建经验者加分。</p><p>10、有深厚的概率与数理统计基础者加分。</p><p><br></p>",民营,http://jobs.zhaopin.com/579020825251044.htm,专业服务/咨询(财会/法律/人力资源等),1人 ,20人以下,上海德熠堂商务咨询有限公司,180.0,1,全职,5-10年,本科,2016-12-19,0.1563570499420166,上海,大数据架构师,jobs.zhaopin.com
25000-35000元/月 ,"<p><span style=""line-height: 1.5;"">岗位职责： </span></p><p>1. 规划保险行业大数据营销产品及解决方案建设及推广计划，探索新的业务模式的创新实践</p><p>2. 服务于保险客户，提供基于大数据的营销咨询及解决方案服务</p><p>3. 根据客户的实际运营，挖掘客户可能存在的问题，并找出解决方案； <br>4. 配合销售团队，提供专业的咨询服务的同时，根据行业特征、规律，协助销售提供售前咨询； <br>5. 根据内部客户或外部客户的需求，整合公司内部产品，形成解决方案。 <br><br>岗位要求： <br>1. 大学本科及以上学历；</p><p>2. 2年及以上咨询行业经验，并且从事保险行业CRM/大数据/精准营销领域咨询；或具备3年及以上在保险行业从事营销、数据分析等相关工作经验； <br>3. 具有3人以上团队管理经验；</p><p>4. 具备良好的沟通、演讲能力，具备优秀的方案编纂、撰写能力，能承受一定的工作压力；</p><p>5. 有数据分析或挖掘经验者优先</p><p>6. 精通Excel、PowerPoint等办公工具。</p><p><br></p>",股份制企业,http://jobs.zhaopin.com/681448026250395.htm,IT服务(系统/数据/维护),1人 ,100-499人,百融(北京)金融信息服务股份有限公司,180.0,1,全职,不限,不限,2016-12-19,0.29355287551879883,上海,大数据营销保险解决方案总监,jobs.zhaopin.com
15000-25000元/月 ,<p>岗位职责：</p><p>1、负责大数据业务的产品设计和市场规划；<br>2、负责大数据业务的行业交流和产品变现；<br>3、组建大数据的产品团队并负责收益；<br></p><p>任职要求：</p><p>1、本科以上学历，五年以上大数据行业咨询经验，三年以上经验/总监工作经验，数据分析销售经验者优先；<br>2、熟悉主流的大数据产品和数据分析技术；<br>3、在客户管理/客户开发，售前项目跟踪具有丰富的经验；<br>4、具备很强的人际沟通交流技巧的经验；<br>5、较强的组织能力和独立的工作能力，有在数据咨询公司：IBM、易观，艾瑞等咨询调研类公司经验者优先；</p>,股份制企业,http://jobs.zhaopin.com/485704921250152.htm,互联网/电子商务,1人 ,100-499人,上海广升信息技术有限公司,180.0,1,全职,3-5年,本科,2016-12-19,0.20918607711791992,上海,研究总监/产品总监（大数据业务）,jobs.zhaopin.com
15000-25000元/月 ,<p>岗位职责：</p><p>1.担任项目总监，管理各类产品售前与实施，参与并监管整体实施过程 ;<br>2.提供数据分析与挖掘方面的咨询 ；<br>3.研发基于大数据的创新产品，从企业需求出发，围绕互联网产品关联销售、客户分析、预测等方面以数据挖掘技术为核心，研发、推广、实施各类产品;<br>4.制定市场营销策略，进行公司整体大数据方向的市场推广;<br></p><p>任职要求：</p><p>任职资格：<br> 1、本科以上学历，五年以上IT行业解决方案咨询经验。三年以上项目总监/咨询总监工作经验；<br> 2、熟悉主流的大数据产品和数据分析技术，熟悉互联网行业；<br> 3、具备很强的人际沟通交流技巧的经验；<br> 4、较强的组织能力和独立的工作能力，有在埃森哲、IBM、艾瑞等咨询公司经验者优先；</p>,股份制企业,http://jobs.zhaopin.com/485704921250144.htm,互联网/电子商务,1人 ,100-499人,上海广升信息技术有限公司,180.0,1,全职,5-10年,本科,2016-12-19,0.2535271644592285,上海,大数据项目总监/咨询总监,jobs.zhaopin.com
15000-25000元/月 ,<p>岗位描述：</p><p>1. 负责数仓的建模和ETL实现</p><p>2. 数据产品的后端ETL设计和实现</p><p>3. 对代码进行调优和维护</p><p><br></p><p>岗位需求：</p><p>1. 2年以上数据相关领域工作经验</p><p>2. 1年以上hadoop相关经验，能熟练使用hive</p><p>3. 有Hive和hadoop相关调优经验的话优先考虑</p><p>4. 有互联网公司或者知名企业工作经验的话更佳</p>,股份制企业,http://jobs.zhaopin.com/537058027251025.htm,IT服务(系统/数据/维护),1人 ,20-99人,艾睦奇企业管理咨询(上海)有限公司,180.0,1,全职,不限,不限,2016-12-19,0.41887593269348145,上海,大数据开发工程师-数据仓库方向,jobs.zhaopin.com
